{
  "$schema": "../../../schemas/plugin.schema.json",
  "name": "context-trim",
  "version": "1.4.2",
  "description": "Truncates failing command output before it reaches the model, keeping the error context and the tail summary. Leaves clean output intact until it is genuinely huge, and attaches a narrowing tip instead, because cutting a result the agent asked for just makes it run the command again. Also logs per-subagent cost so you can check whether delegating pays off. No agents, no prompting, nothing to remember.",
  "keywords": [
    "context",
    "token",
    "truncation",
    "cost",
    "hooks"
  ],
  "license": "MIT"
}
